29/08/2024,19:48:05,John,+1234567890,Hey there! How are you doing?
29/08/2024,19:50:22,Emma,+0987654321,Great! Just planning our next trip.
02/09/2024,14:18:55,Mike,+1122334455,Congratulations on the new job!
07/09/2024,12:44:19,Emma,+0987654321,Feel free to write without abbreviations here.
23/09/2024,15:06:42,John,+1234567890,Learning a new language is always exciting.
01/10/2024,10:11:27,Emma,+0987654321,Happy birthday! Wishing you all the best.
01/10/2024,10:20:50,Mike,+1122334455,Thank you so much!
11/10/2024,11:38:56,John,+1234567890,We're currently traveling in Croatia.
30/10/2024,12:22:10,Emma,+0987654321,How have you been? Any updates?
01/11/2024,21:32:26,John,+1234567890,Everything is going well. Work and studies continue.
01/11/2024,21:55:38,John,+1234567890,Photo message
01/11/2024,21:55:43,John,+1234567890,Photo message